"810-8561","福岡県福岡市中央区天神1−14−16 株式会社ＪＴＢ九州","2013-03-01 00:35:52.000000"
"810-8631","福岡県福岡市中央区天神1丁目14−16三栄ビル5階 株式会社東食　福岡支店","2013-03-01 00:35:52.000000"
"810-8619","福岡県福岡市中央区渡辺通4丁目2−11 学校法人　河合塾　福岡校","2013-03-01 00:35:52.000000"
"810-8588","福岡県福岡市中央区薬院1−1−1 キューサイ　株式会社","2013-03-01 00:35:52.000000"
"810-8606","福岡県福岡市中央区草香江1丁目7−16 キューサイ　株式会社","2013-03-01 00:35:52.000000"
"810-8560","福岡県福岡市中央区六本松4丁目2−1 九州大学　六本松地区部局（大学教育研究センター、大学院比較社会文化研究科、言語文化部）","2013-03-01 00:35:52.000000"
"810-8617","福岡県福岡市中央区天神1丁目12−20−8Ｆ 九州通信ネットワーク　株式会社","2013-03-01 00:35:52.000000"
"810-8636","福岡県福岡市中央区薬院3丁目2−23 九州三菱自動車販売　株式会社","2013-03-01 00:35:52.000000"
"810-8509","福岡県福岡市中央区大手門3丁目3−3 九州労働金庫","2013-03-01 00:35:52.000000"
"810-8532","福岡県福岡市中央区天神2丁目14−8ＦＴＣビル15Ｆ キリンビール　株式会社　九州支社","2013-03-01 00:35:52.000000"
"810-8601","福岡県福岡市中央区天神4丁目9−15文化ビル1Ｆ 月刊うるとらマンボウ　株式会社　アートライン","2013-03-01 00:35:52.000000"
"810-8563","福岡県福岡市中央区地行浜1丁目8−1 国立病院機構　九州医療センター","2013-03-01 00:35:52.000000"
"810-8533","福岡県福岡市中央区天神2丁目14−13天神三井ビル4Ｆ コスモ石油　株式会社　福岡支店","2013-03-01 00:35:52.000000"
"810-8539","福岡県福岡市中央区舞鶴3丁目5−27 国家公務員共済組合連合会浜の町病院","2013-03-01 00:35:52.000000"
"810-8670","福岡県福岡市中央区大手門3丁目5−3 資生堂化粧品販売　株式会社　福岡支社","2013-03-01 00:35:52.000000"
"810-8607","福岡県福岡市中央区渡辺通3丁目6−11 清水建設　株式会社　九州支店","2013-03-01 00:35:52.000000"
"810-8685","福岡県福岡市中央区天神1丁目11−17福岡ビル8Ｆ（福岡中央郵便局私書箱第94号） 新日本石油　株式会社　九州支店","2013-03-01 00:35:52.000000"
"810-8663","福岡県福岡市中央区大手門3丁目3−13 新日本法規出版　株式会社　福岡支社","2013-03-01 00:35:52.000000"
"810-8734","福岡県福岡市中央区西中洲6−27（福岡中央郵便局私書箱第157号） 親和銀行　福岡営業部","2013-03-01 00:35:52.000000"
"810-8657","福岡県福岡市中央区天神4丁目1−37 住宅金融公庫　福岡支店","2013-03-01 00:35:52.000000"
"810-8572","福岡県福岡市中央区天神2丁目8−34 住友生命保険　相互会社　福岡支社","2013-03-01 00:35:52.000000"
"810-8518","福岡県福岡市中央区天神1丁目1−1アクロス福岡6階 住友林業株式会社　営業本部九州支店","2013-03-01 00:35:52.000000"
"810-8611","福岡県福岡市中央区舞鶴1丁目1−7 全労済福岡県本部","2013-03-01 00:35:52.000000"
"810-8504","福岡県福岡市中央区天神3丁目9−33ＫＧ天神ビル1・3・4階 総合メディカル　株式会社","2013-03-01 00:35:52.000000"
"810-8511","福岡県福岡市中央区大手門1丁目1−7 大成建設　株式会社　九州支店","2013-03-01 00:35:52.000000"
"810-8553","福岡県福岡市中央区西中洲12−33 大同生命保険　相互会社　福岡支社","2013-03-01 00:35:52.000000"
"810-8583","福岡県福岡市中央区天神4丁目8−10 都久志会館","2013-03-01 00:35:52.000000"
"810-8516","福岡県福岡市中央区今泉1丁目12−33西鉄今泉ビル5Ｆ 天神エフエム　株式会社","2013-03-01 00:35:52.000000"
"810-8502","福岡県福岡市中央区白金2丁目13−12 戸田建設　株式会社　九州支店","2013-03-01 00:35:52.000000"
"810-8519","福岡県福岡市中央区天神3丁目11−1天神武藤ビル4階 トップツアー　株式会社　福岡支店","2013-03-01 00:35:52.000000"
"810-8603","福岡県福岡市中央区長浜2丁目1−5 トヨタカローラ福岡　株式会社","2013-03-01 00:35:52.000000"
"810-8610","福岡県福岡市中央区長浜2丁目2−4 独立行政法人　都市再生機構　九州支社","2013-03-01 00:35:52.000000"
"810-8570","福岡県福岡市中央区天神1丁目11−17（福岡中央郵便局私書箱第44号） 西日本鉄道　株式会社","2013-03-01 00:35:52.000000"
"810-8540","福岡県福岡市中央区高砂1丁目10−1 西日本プラント工業　株式会社","2013-03-01 00:35:52.000000"
"810-8535","福岡県福岡市中央区天神2丁目4番38号 西日本電信電話　株式会社　福岡支店","2013-03-01 00:35:52.000000"
"810-8531","福岡県福岡市中央区天神1丁目6−8 日本総合信用　株式会社　福岡支店","2013-03-01 00:35:52.000000"
"810-8650","福岡県福岡市中央区地行浜2−2−3 ヒルトン福岡シーホーク","2013-03-01 00:35:52.000000"
"810-8652","福岡県福岡市中央区大手門1丁目7−1 福岡家庭裁判所","2013-03-01 00:35:52.000000"
"810-8654","福岡県福岡市中央区城内1−1 福岡簡易裁判所","2013-03-01 00:35:52.000000"
"810-8515","福岡県福岡市中央区赤坂1丁目8−8 福岡県　西福岡県税事務所","2013-03-01 00:35:52.000000"
"810-8538","福岡県福岡市中央区天神5丁目3−1 福岡県住宅供給公社","2013-03-01 00:35:52.000000"
"810-8608","福岡県福岡市中央区城内1−1 福岡高等裁判所","2013-03-01 00:35:52.000000"
"810-8622","福岡県福岡市中央区大名2丁目5−31 福岡市　中央区役所","2013-03-01 00:35:52.000000"
"810-8621","福岡県福岡市中央区天神1丁目8−1 福岡市教育委員会","2013-03-01 00:35:52.000000"
"810-8521","福岡県福岡市中央区舞鶴3丁目9−7 福岡市消防局","2013-03-01 00:35:52.000000"
"810-8620","福岡県福岡市中央区天神1丁目8−1 福岡市役所","2013-03-01 00:35:52.000000"
"810-8651","福岡県福岡市中央区舞鶴2丁目5−30 福岡地方検察庁","2013-03-01 00:35:52.000000"
"810-8653","福岡県福岡市中央区城内1−1 福岡地方裁判所","2013-03-01 00:35:52.000000"
"810-8609","福岡県福岡市中央区赤坂1丁目6−19 福岡中央公共職業安定所","2013-03-01 00:35:52.000000"
"810-8605","福岡県福岡市中央区長浜2丁目1−1 福岡中央労働基準監督署","2013-03-01 00:35:52.000000"
"810-8798","福岡県福岡市中央区薬院2丁目6−11 福岡逓信病院","2013-03-01 00:35:52.000000"
"810-8722","福岡県福岡市中央区渡辺通4丁目8−28 福岡トヨタ自動車　株式会社","2013-03-01 00:35:52.000000"
"810-8513","福岡県福岡市中央区舞鶴3丁目9−15 福岡法務局","2013-03-01 00:35:52.000000"
"810-8660","福岡県福岡市中央区地行浜2丁目2−2 福岡Ｙａｈｏｏ！ＪＡＰＡＮドーム","2013-03-01 00:35:52.000000"
"810-8637","福岡県福岡市中央区大名2丁目4−35 富士火災海上保険株式会社　九州本部","2013-03-01 00:35:52.000000"
"810-8566","福岡県福岡市中央区天神4丁目2−20天神幸ビル3Ｆ 富士産業　株式会社　福岡支店","2013-03-01 00:35:52.000000"
"810-8551","福岡県福岡市中央区天神1丁目16−1 毎日新聞社　福岡総局","2013-03-01 00:35:52.000000"
"810-8506","福岡県福岡市中央区薬院3丁目4−9 松尾建設　株式会社　福岡支店","2013-03-01 00:35:52.000000"
"810-8530","福岡県福岡市中央区薬院3丁目1−24 松下電工　株式会社　九州地区担当部","2013-03-01 00:35:52.000000"
"810-8683","福岡県福岡市中央区赤坂1丁目16−14（福岡中央郵便局私書箱第26号） 三井住友海上火災保険　株式会社","2013-03-01 00:35:52.000000"
"810-8527","福岡県福岡市中央区大手門1丁目1−12 三井松島産業　株式会社","2013-03-01 00:35:52.000000"
"810-8725","福岡県福岡市中央区天神1丁目14−1（福岡中央郵便局私書箱第224号） ＵＦＪ信託銀行　株式会社　福岡支店","2013-03-01 00:35:52.000000"
"810-8546","福岡県福岡市中央区渡辺通2丁目3−461Ｆ 有限会社　サウンドトラック","2013-03-01 00:35:52.000000"
"810-8581","福岡県福岡市中央区赤坂1丁目16−5 読売新聞　西部本社","2013-03-01 00:35:52.000000"
"810-8571","福岡県福岡市中央区長浜1丁目1−1 九州朝日放送　株式会社","2013-03-01 00:35:52.000000"
"810-8575","福岡県福岡市中央区渡辺通2丁目1−82電気ビル内 株式会社　エフエム福岡","2013-03-01 00:35:52.000000"
"810-8577","福岡県福岡市中央区六本松1丁目1−10 日本放送協会　福岡放送局","2013-03-01 00:35:52.000000"
"810-8675","福岡県福岡市中央区赤坂1丁目16−10（福岡中央郵便局私書箱第187号） 株式会社　電通九州","2013-03-01 00:35:52.000000"
"810-8717","福岡県福岡市中央区天神1丁目4−1（福岡中央郵便局私書箱第249号） 株式会社　博多大丸","2013-03-01 00:35:52.000000"
"810-8727","福岡県福岡市中央区天神2丁目13−1（福岡中央郵便局私書箱第133号） 株式会社　福岡銀行","2013-03-01 00:35:52.000000"
"810-8676","福岡県福岡市中央区大名2丁目12−1（福岡中央郵便局私書箱第64号） 株式会社　福岡中央銀行","2013-03-01 00:35:52.000000"
"810-8720","福岡県福岡市中央区渡辺通2丁目1−82（福岡中央郵便局私書箱第69号） 九州電力　株式会社","2013-03-01 00:35:52.000000"
"810-8707","福岡県福岡市中央区天神1丁目14−1（福岡中央郵便局私書箱第92号） 日本生命保険　相互会社　福岡総支社","2013-03-01 00:35:52.000000"
"810-8673","福岡県福岡市中央区渡辺通4丁目9−18（福岡中央郵便局私書箱第33号） 福岡酒類販売　株式会社","2013-03-01 00:35:52.000000"
"810-8689","福岡県福岡市中央区天神4丁目8−28（福岡中央郵便局私書箱第25号） 福岡税務署","2013-03-01 00:35:52.000000"
"810-8688","福岡県福岡市中央区天神2丁目8−49（福岡中央郵便局私書箱第116号） 丸紅　株式会社　九州支社","2013-03-01 00:35:52.000000"
"810-8678","福岡県福岡市中央区天神2丁目12−1天神ビル9Ｆ（福岡中央郵便局私書箱第122号） 三菱商事　株式会社　九州支社","2013-03-01 00:35:52.000000"
"810-8710","福岡県福岡市中央区天神1丁目11−17（福岡中央郵便局私書箱第20号） 三菱信託銀行　株式会社　福岡支店","2013-03-01 00:35:52.000000"
"810-8686","福岡県福岡市中央区天神2丁目12−1（福岡中央郵便局私書箱第206号） 三菱電機　株式会社　九州支社","2013-03-01 00:35:52.000000"
"840-8558","佐賀県佐賀市城内1丁目6−10 株式会社　サガテレビ","2013-03-01 00:35:52.000000"
"840-8520","佐賀県佐賀市天神1丁目4−3 株式会社　佐電工","2013-03-01 00:35:52.000000"
"840-8511","佐賀県佐賀市白山2丁目2−5 株式会社　北島","2013-03-01 00:35:52.000000"
"840-8552","佐賀県佐賀市巨勢町大字牛島710 株式会社　九州西友　佐賀巨勢店","2013-03-01 00:35:52.000000"
"840-8580","佐賀県佐賀市中の小路2−5 株式会社　佐賀玉屋","2013-03-01 00:35:52.000000"
"840-8588","佐賀県佐賀市水ヶ江2丁目11−23 株式会社　中野建設","2013-03-01 00:35:52.000000"
"840-8550","佐賀県佐賀市本庄町大字本庄1313 学校法人　旭学園佐賀女子短期大学","2013-03-01 00:35:52.000000"
"840-8540","佐賀県佐賀市松原1丁目1−16 佐賀県　警察本部","2013-03-01 00:35:52.000000"
"840-8571","佐賀県佐賀市水ヶ江1丁目12−9 佐賀県立病院好生館","2013-03-01 00:35:52.000000"
"840-8501","佐賀県佐賀市栄町1−1 佐賀市役所","2013-03-01 00:35:52.000000"
"840-8585","佐賀県佐賀市天神3丁目2−23 佐賀新聞社","2013-03-01 00:35:52.000000"
"840-8502","佐賀県佐賀市本庄町1 佐賀大学","2013-03-01 00:35:52.000000"
"840-8555","佐賀県佐賀市嘉瀬町扇町2507−4 佐賀ダイハツ販売　株式会社","2013-03-01 00:35:52.000000"
"840-8560","佐賀県佐賀市駅南本町6−4佐賀中央第一生命ビル 全国健康保険協会　佐賀支部","2013-03-01 00:35:52.000000"
"840-8666","佐賀県佐賀市八幡小路1−10（佐賀中央郵便局私書箱第33号） 松尾建設　株式会社","2013-03-01 00:35:52.000000"
"840-8551","佐賀県佐賀市巨勢町大字牛島730 モラージュ佐賀","2013-03-01 00:35:52.000000"
"840-8570","佐賀県佐賀市城内1丁目1−59 佐賀県庁","2013-03-01 00:35:52.000000"
"840-8627","佐賀県佐賀市唐人2丁目7−20（佐賀中央郵便局私書箱第27号） 株式会社　佐賀銀行","2013-03-01 00:35:52.000000"
"840-8686","佐賀県佐賀市伊勢町15−1（佐賀中央郵便局私書箱第6号） 株式会社　ミゾタ","2013-03-01 00:35:52.000000"
"840-8689","佐賀県佐賀市松原1丁目2−35（佐賀中央郵便局私書箱第81号） 佐賀県　信用保証協会","2013-03-01 00:35:52.000000"
"840-8688","佐賀県佐賀市松原1丁目2−35（佐賀中央郵便局私書箱第73号） 佐賀商工会議所","2013-03-01 00:35:52.000000"
"840-8611","佐賀県佐賀市駅前中央3丁目3−20佐賀第二合同庁舎 佐賀税務署","2013-03-01 00:35:52.000000"
"840-8601","佐賀県佐賀市城内2丁目15−8（佐賀中央郵便局私書箱第71号） 日本放送協会　佐賀放送局","2013-03-01 00:35:52.000000"
"860-8545","熊本県熊本市水道町8番6号朝日生命熊本ビル6Ｆ 株式会社　ユニマットライフ　ユニマットレディス　熊本店","2013-03-01 00:35:52.000000"
"860-8792","熊本県熊本市春日5丁目17番9号 九州物流センター","2013-03-01 00:35:52.000000"
"860-8796","熊本県熊本市城東町1−1 熊本監査室","2013-03-01 00:35:52.000000"
"860-8540","熊本県熊本市高平3丁目41−13 コマツ西日本　株式会社","2013-03-01 00:35:52.000000"
"862-8793","熊本県熊本市城東町1−1 日本郵便　株式会社　九州支社　郵便事業本部（三種）","2013-03-01 00:35:52.000000"
"860-8512","熊本県熊本市花畑町12−28日本生命熊本第2ビル4Ｆ 楽天ＫＣ　株式会社　熊本支店","2013-03-01 00:35:52.000000"
"889-1692","宮崎県宮崎郡清武町大字木原5200 宮崎大学　医学部","2013-03-01 00:35:52.000000"
"886-0292","宮崎県西諸県郡野尻町大字東麓1183−2 野尻町役場","2013-03-01 00:35:52.000000"
"899-7692","鹿児島県志布志市松山町新橋268 志布志市役所　松山支所","2013-03-01 00:35:52.000000"
"899-5292","鹿児島県姶良郡加治木町諏訪町113 加治木社会保険事務所","2013-03-01 00:35:52.000000"
"899-5294","鹿児島県姶良郡加治木町本町253（加治木郵便局私書箱第8号） 加治木町役場","2013-03-01 00:35:52.000000"
"899-5293","鹿児島県姶良郡加治木町木田1882 国立療養所　南九州病院","2013-03-01 00:35:52.000000"
"899-5495","鹿児島県姶良郡姶良町東餅田336 株式会社　マイカル南九州サンシティリブレ","2013-03-01 00:35:52.000000"
"899-5693","鹿児島県姶良郡姶良町池島町30番地15号 医療法人　青雲病院","2013-03-01 00:35:52.000000"
"899-5698","鹿児島県姶良郡姶良町平松5000番地 株式会社　イケダパン","2013-03-01 00:35:52.000000"
"899-5694","鹿児島県姶良郡姶良町平松7233 株式会社　ランドアート","2013-03-01 00:35:52.000000"
"899-5392","鹿児島県姶良郡蒲生町上久徳2399 蒲生町役場","2013-03-01 00:35:52.000000"
"900-8553","沖縄県那覇市泉崎1−1−1−11階 那覇市教育委員会","2013-03-01 00:35:52.000000"
