"061-2273","北海道札幌市南区豊滝","2014-09-01 00:55:08.000000"
"061-1423","北海道恵庭市柏木町","2014-09-01 00:55:08.000000"
"061-3331","北海道石狩市厚田区聚富（中央、シラツカリ）","2014-09-01 00:55:08.000000"
"061-3441","北海道石狩市厚田区聚富（その他）","2014-09-01 00:55:08.000000"
"061-3605","北海道石狩市厚田区別狩","2014-09-01 00:55:08.000000"
"061-3112","北海道石狩市浜益区送毛","2014-09-01 00:55:08.000000"
"077-0351","北海道石狩市浜益区雄冬","2014-09-01 00:55:08.000000"
"061-3106","北海道石狩市浜益区川下","2014-09-01 00:55:08.000000"
"061-3102","北海道石狩市浜益区群別","2014-09-01 00:55:08.000000"
"061-3113","北海道石狩市浜益区濃昼","2014-09-01 00:55:08.000000"
"061-3109","北海道石狩市浜益区御料地","2014-09-01 00:55:08.000000"
"061-3105","北海道石狩市浜益区千代志別","2014-09-01 00:55:08.000000"
"061-3104","北海道石狩市浜益区床丹","2014-09-01 00:55:08.000000"
"061-3111","北海道石狩市浜益区毘砂別","2014-09-01 00:55:08.000000"
"061-3103","北海道石狩市浜益区幌","2014-09-01 00:55:08.000000"
"061-3108","北海道石狩市浜益区実田","2014-09-01 00:55:08.000000"
"486-0841","愛知県春日井市南下原町","2014-09-01 00:55:08.000000"
"756-0805","山口県山陽小野田市自由ケ丘","2014-09-01 00:55:08.000000"
"040-8566","北海道函館市五稜郭町32番4号 株式会社　ハコセン","2014-09-01 00:55:08.000000"
"999-7695","山形県鶴岡市渡前字大坪45 株式会社　スタンレー　鶴岡製作所","2014-09-01 00:55:08.000000"
"305-8555","茨城県つくば市苅間2530番地2（研究学園Ｄ32街区2画地） つくば市役所","2014-09-01 00:55:08.000000"
"260-8504","千葉県千葉市中央区千葉港8−4 株式会社　損害保険ジャパン","2014-09-01 00:55:08.000000"
"260-8560","千葉県千葉市中央区鶴沢町20番16号 株式会社　損害保険ジャパン","2014-09-01 00:55:08.000000"
"260-8505","千葉県千葉市中央区千葉港8−4 日本興亜損害保険　株式会社　千葉支店","2014-09-01 00:55:08.000000"
"273-8558","千葉県船橋市湊町2丁目8−11 千葉地方法務局　船橋支局","2014-09-01 00:55:08.000000"
"273-8551","千葉県船橋市宮本3丁目10−3 ユアサ・フナショク　株式会社","2014-09-01 00:55:08.000000"
"101-8911","東京都千代田区神田駿河台2丁目9 主婦の友社","2014-09-01 00:55:08.000000"
"101-8668","東京都千代田区神田駿河台2丁目9（神田郵便局私書箱第79号） 株式会社　主婦の友社","2014-09-01 00:55:08.000000"
"102-8578","東京都千代田区紀尾井町4−1 株式会社　ホテルニューオータニ","2014-09-01 00:55:08.000000"
"105-8712","東京都港区西新橋2丁目15−12（芝郵便局私書箱第70号） 日立キャピタル　株式会社","2014-09-01 00:55:08.000000"
"108-8586","東京都港区高輪2丁目19−19 日本トムソン　株式会社","2014-09-01 00:55:08.000000"
"135-8573","東京都江東区枝川1丁目9−6 （株）ジャノメクレディア　出光クレジット係","2014-09-01 00:55:08.000000"
"135-8464","東京都江東区永代1丁目14−5永代ダイヤビル13Ｆ 財団法人　競馬農林水産情報衛星通信機構　（グリーンチャンネル）","2014-09-01 00:55:08.000000"
"135-8513","東京都江東区永代2丁目37−25 澁澤倉庫　株式会社","2014-09-01 00:55:08.000000"
"135-8574","東京都江東区枝川1丁目9−6 ジャノメクレディア　情報処理本部","2014-09-01 00:55:08.000000"
"141-8508","東京都品川区西五反田2丁目32−4 イワタボルト　株式会社","2014-09-01 00:55:08.000000"
"141-8672","東京都品川区大崎1丁目2−1 株式会社　日立情報システムズ","2014-09-01 00:55:08.000000"
"167-8602","東京都杉並区本天沼2丁目46−6（荻窪郵便局私書箱第32号） 株式会社　イー・エス・エス","2014-09-01 00:55:08.000000"
"167-8601","東京都杉並区本天沼2丁目46−6（荻窪郵便局私書箱第32号） 株式会社　イー・エス・エス","2014-09-01 00:55:08.000000"
"167-8070","東京都杉並区本天沼2丁目46−6（荻窪郵便局私書箱第32号） 株式会社　イー・エス・エス","2014-09-01 00:55:08.000000"
"121-8504","東京都足立区島根1丁目9−6 杉本興業　株式会社","2014-09-01 00:55:08.000000"
"190-8539","東京都立川市栄町6丁目1−1立飛ビル6号館別館 株式会社　ＪＣＮマイテレビ","2014-09-01 00:55:08.000000"
"948-8504","新潟県十日町市宮田町1−5 東北電力　株式会社　十日町営業所","2014-09-01 00:55:08.000000"
"923-8686","石川県小松市新町86（小松郵便局私書箱第16号） 小倉織物　株式会社","2014-09-01 00:55:08.000000"
"460-8636","愛知県名古屋市中区錦1丁目16−20グリーンビル 日本火災海上保険　株式会社　中部営業本部","2014-09-01 00:55:08.000000"
"460-8551","愛知県名古屋市中区丸の内3丁目22−21損保ジャパン名古屋ビル 株式会社　損害保険ジャパン　中部本部","2014-09-01 00:55:08.000000"
"480-0195","愛知県丹羽郡大口町大字豊田字野田1 株式会社　東海理化電機製作所","2014-09-01 00:55:08.000000"
"480-0197","愛知県丹羽郡大口町大字小口字乗船1 ヤマザキマザック　株式会社","2014-09-01 00:55:08.000000"
"519-4393","三重県熊野市井戸町371 三重県紀南県民局　紀南振興事務所","2014-09-01 00:55:08.000000"
"540-8578","大阪府大阪市中央区城見1丁目4−1 株式会社　ホテルニューオータニ　ホテルニューオータニ大阪","2014-09-01 00:55:08.000000"
"562-8522","大阪府箕面市船場東3丁目10−2 宇野　株式会社","2014-09-01 00:55:08.000000"
"636-0293","奈良県磯城郡川西町大字唐院712−10 大日本印刷　株式会社　ＢＦ事業部奈良工場","2014-09-01 00:55:08.000000"
"640-8503","和歌山県和歌山市橋丁34番地 株式会社　貴志","2014-09-01 00:55:08.000000"
"812-8624","福岡県福岡市博多区対馬小路10−3 伊藤忠食品　株式会社　福岡支店","2014-09-01 00:55:08.000000"
