"314-0112","茨城県神栖市知手中央","2014-01-06 00:44:44.000000"
"300-1150","茨城県稲敷郡阿見町よしわら","2014-01-06 00:44:44.000000"
"372-0831","群馬県伊勢崎市山王町","2014-01-06 00:44:44.000000"
"213-0013","神奈川県川崎市高津区末長","2014-01-06 00:44:44.000000"
"943-0893","新潟県上越市大貫","2014-01-06 00:44:44.000000"
"939-1355","富山県砺波市杉木","2014-01-06 00:44:44.000000"
"930-0220","富山県中新川郡立山町前沢中央町","2014-01-06 00:44:44.000000"
"502-0929","岐阜県岐阜市則武東","2014-01-06 00:44:44.000000"
"794-0069","愛媛県今治市クリエイティブヒルズ","2014-01-06 00:44:44.000000"
"794-0067","愛媛県今治市高橋ふれあいの丘","2014-01-06 00:44:44.000000"
"794-0068","愛媛県今治市にぎわい広場","2014-01-06 00:44:44.000000"
"020-0691","岩手県滝沢市土沢220−5 岩手県学校生活　協同組合","2014-01-06 00:44:44.000000"
"020-0693","岩手県滝沢市巣子152−52 岩手県立大学","2014-01-06 00:44:44.000000"
"020-0690","岩手県滝沢市土沢220−3 いわて生活　協同組合","2014-01-06 00:44:44.000000"
"020-0698","岩手県滝沢市外山309 株式会社　ミクニ","2014-01-06 00:44:44.000000"
"020-0692","岩手県滝沢市中鵜飼55 滝沢市役所","2014-01-06 00:44:44.000000"
"020-0694","岩手県滝沢市砂込808 盛岡大学","2014-01-06 00:44:44.000000"
"371-8521","群馬県前橋市大手町2の4の9 朝日新聞前橋総局","2014-01-06 00:44:44.000000"
"100-8450","東京都千代田区有楽町1−1−3東京宝塚ビル15階 日本映画衛星放送　株式会社","2014-01-06 00:44:44.000000"
"103-8248","東京都中央区日本橋1−15−1パーカービル 株式会社　馬渕商事","2014-01-06 00:44:44.000000"
"103-8503","東京都中央区日本橋箱崎町36−2リバーゲート13階 協和発酵キリン　株式会社　東京支店","2014-01-06 00:44:44.000000"
"104-8340","東京都中央区京橋3−1−1 株式会社　ブリヂストン","2014-01-06 00:44:44.000000"
"104-8345","東京都中央区京橋1丁目17番10号住友商事京橋ビル 東洋紡　株式会社","2014-01-06 00:44:44.000000"
"105-8565","東京都港区虎ノ門1−2−8 株式会社　日経ラジオ社","2014-01-06 00:44:44.000000"
"106-8622","東京都港区六本木1−6−1泉ガーデンタワー15Ｆ ＳＢＩマーケティング　株式会社","2014-01-06 00:44:44.000000"
"108-8520","東京都港区芝浦2丁目12−13 株式会社　タツノ","2014-01-06 00:44:44.000000"
"108-8555","東京都港区芝浦4−9−25芝浦スクエアビル 株式会社　リクルートフォレントインシュア","2014-01-06 00:44:44.000000"
"112-8677","東京都文京区関口1丁目45−15 ＮＫＳＪシステムズ　株式会社","2014-01-06 00:44:44.000000"
"112-8677","東京都文京区関口1丁目45−15 ＮＫＳＪホールディングス","2014-01-06 00:44:44.000000"
"112-8677","東京都文京区関口1丁目45−15 株式会社　プライムアシスタンス","2014-01-06 00:44:44.000000"
"112-8677","東京都文京区関口1丁目45−15 日本興亜ホットライン２４　株式会社","2014-01-06 00:44:44.000000"
"113-8570","東京都文京区湯島2丁目31−20 フクダ電子　株式会社","2014-01-06 00:44:44.000000"
"131-8139","東京都墨田区押上1−1−2東京スカイツリータウン・ソラマチ9階 公益財団法人　通信文化協会","2014-01-06 00:44:44.000000"
"190-8575","東京都立川市緑町4−2 関東財務局　立川出張所","2014-01-06 00:44:44.000000"
"190-8609","東京都立川市緑町4−2立川地方合同庁舎 立川公共職業安定所","2014-01-06 00:44:44.000000"
"190-8516","東京都立川市緑町4−2 立川労働基準監督署","2014-01-06 00:44:44.000000"
"184-8584","東京都小金井市梶野町3丁目7−2 法政大学　工学部","2014-01-06 00:44:44.000000"
"210-8551","神奈川県川崎市川崎区日進町1−53興和川崎東口ビル 東芝ＩＴサービス　株式会社","2014-01-06 00:44:44.000000"
"934-8686","富山県高岡市下牧野36−2 石友ホーム　株式会社","2014-01-06 00:44:44.000000"
"920-8707","石川県金沢市広岡1丁目1−18 伊藤忠商事　株式会社　金沢支店","2014-01-06 00:44:44.000000"
"920-8680","石川県金沢市長田2丁目25番19号 株式会社　近畿しんきんカード　北陸支社","2014-01-06 00:44:44.000000"
"920-8721","石川県金沢市小金町9番18号 株式会社　熊谷組　北陸支店","2014-01-06 00:44:44.000000"
"920-8677","石川県金沢市広岡1−4−16 前多　株式会社","2014-01-06 00:44:44.000000"
"922-8522","石川県加賀市大聖寺八間道65 加賀市民病院","2014-01-06 00:44:44.000000"
"915-8588","福井県越前市塚町101番地 丹南ケーブルテレビ　株式会社","2014-01-06 00:44:44.000000"
"399-4693","長野県上伊那郡箕輪町大字中箕輪8787 ＨＯＹＡ　株式会社　ビジョンケア部門　松島工場","2014-01-06 00:44:44.000000"
"509-0296","岐阜県可児市二野字南山2706番3 株式会社　日特スパークテック東濃","2014-01-06 00:44:44.000000"
"460-8366","愛知県名古屋市中区栄4丁目16−33 日本経済新聞社　名古屋支社","2014-01-06 00:44:44.000000"
"651-8514","兵庫県神戸市中央区脇浜町2−11−14神戸脇浜ビル 日本年金機構　兵庫事務センター","2014-01-06 00:44:44.000000"
"640-8564","和歌山県和歌山市南桶屋町7番地 株式会社　ゴトウ洋服店","2014-01-06 00:44:44.000000"
"732-8568","広島県広島市東区若草町12番1号アクティブインターシティ広島7階 株式会社　明治　中四国支社","2014-01-06 00:44:44.000000"
"805-8555","福岡県北九州市八幡東区大字前田字大塚1320−4 日鉄住金テックスエンジ　株式会社　北九州事業センター","2014-01-06 00:44:44.000000"
"850-8525","長崎県長崎市出島町15番7号ＮＫ出島スクエアビル ジブラルタ生命保険　株式会社","2014-01-06 00:44:44.000000"
"902-8513","沖縄県那覇市与儀1−24−1 沖縄県立看護大学","2014-01-06 00:44:44.000000"
