"989-0508","宮城県刈田郡七ヶ宿町長老","2011-05-02 09:37:02.000000"
"285-0850","千葉県佐倉市西ユーカリが丘","2011-05-02 09:37:02.000000"
"929-0108","石川県能美市能美","2011-05-02 09:37:02.000000"
"470-2207","愛知県知多郡阿久比町陽なたの丘","2011-05-02 09:37:02.000000"
"759-0211","山口県宇部市西宇部北","2011-05-02 09:37:02.000000"
"099-2194","北海道北見市端野町二区471番地1 北見市教育委員会","2011-05-02 09:37:02.000000"
"094-8709","北海道紋別市緑町5丁目6−8（紋別支店私書箱第19号） 広域紋別病院企業団","2011-05-02 09:37:02.000000"
"980-8415","宮城県仙台市青葉区本町2−15−1ルナール仙台1階 株式会社　東日本放送　営業センター","2011-05-02 09:37:02.000000"
"305-8504","茨城県つくば市高野台二丁目8番14号 クリタ分析センター　株式会社","2011-05-02 09:37:02.000000"
"371-8567","群馬県前橋市大渡町1−10−7 群馬労働局","2011-05-02 09:37:02.000000"
"278-8601","千葉県野田市野田250番地（野田支店私書箱第1号） キッコーマンバイオケミファ　株式会社","2011-05-02 09:37:02.000000"
"279-8585","千葉県浦安市舞浜1−8 株式会社　ホテルオークラ東京ベイ","2011-05-02 09:37:02.000000"
"100-8216","東京都千代田区丸の内1丁目3−1 一般社団法人　全国銀行協会","2011-05-02 09:37:02.000000"
"101-8477","東京都千代田区神田小川町3丁目22 ミズノ　株式会社","2011-05-02 09:37:02.000000"
"102-8630","東京都千代田区平河町2丁目7番9号ＪＡ共済ビル 全国共済農業協同組合連合会　全国本部","2011-05-02 09:37:02.000000"
"103-8434","東京都中央区日本橋小網町19−8ＩＷ日本橋ビル 岩城製薬　株式会社","2011-05-02 09:37:02.000000"
"104-8553","東京都中央区入船2丁目1−1 キッコーマンソイフーズ　株式会社","2011-05-02 09:37:02.000000"
"104-8356","東京都中央区京橋1丁目13番1号 大日本住友製薬　株式会社","2011-05-02 09:37:02.000000"
"104-8377","東京都中央区京橋2丁目3−13 東洋インキＳＣホールディングス　株式会社","2011-05-02 09:37:02.000000"
"104-8554","東京都中央区湊2−12−11 平野通信機材　株式会社","2011-05-02 09:37:02.000000"
"105-8550","東京都港区浜松町1−21−2 礎会館（東京電力労働組合）","2011-05-02 09:37:02.000000"
"105-8488","東京都港区西新橋3−23−5 岩田地崎建設　株式会社","2011-05-02 09:37:02.000000"
"106-8622","東京都港区六本木1丁目9番9号六本木ファーストビル18階 ＳＢＩマーケティング　株式会社","2011-05-02 09:37:02.000000"
"108-8611","東京都港区高輪4丁目10番30号 品川プリンスホテル","2011-05-02 09:37:02.000000"
"108-8388","東京都港区高輪2−21−43ＹＣＣ高輪ビル 横浜化成　株式会社","2011-05-02 09:37:02.000000"
"163-0867","東京都新宿区西新宿2−4−1新宿ＮＳビル23階 株式会社　京王エージェンシー","2011-05-02 09:37:02.000000"
"169-8526","東京都新宿区大久保2−2−6ラクサス東新宿ビル7Ｆ 生活協同組合　パルシステム東京","2011-05-02 09:37:02.000000"
"169-8527","東京都新宿区大久保2−2−6ラクサス東新宿ビル6Ｆ パルシステム　生活協同組合連合会","2011-05-02 09:37:02.000000"
"136-8640","東京都江東区新砂1−2−3 株式会社　日本デジタル研究所","2011-05-02 09:37:02.000000"
"136-8686","東京都江東区南砂2−36−11 株式会社　三越伊勢丹通信販売","2011-05-02 09:37:02.000000"
"136-8908","東京都江東区新砂1−2−10 株式会社　明治","2011-05-02 09:37:02.000000"
"141-8610","東京都品川区大崎2丁目10−1 ソニー　株式会社　大崎西テクノロジーセンター","2011-05-02 09:37:02.000000"
"154-8545","東京都世田谷区三軒茶屋2丁目11−22サンタワーズセンタービル10Ｆ 公益財団法人　プラン・ジャパン","2011-05-02 09:37:02.000000"
"156-8506","東京都世田谷区上北沢2−1−6 財団法人　東京都医学総合研究所","2011-05-02 09:37:02.000000"
"173-8666","東京都板橋区加賀1丁目21−1 東洋インキＳＣホールディングス　株式会社　十条センター","2011-05-02 09:37:02.000000"
"220-8620","神奈川県横浜市西区みなとみらい3−6−1みなとみらいセンタービル14階 大和ハウス工業　株式会社　横浜支社","2011-05-02 09:37:02.000000"
"226-8512","神奈川県横浜市緑区中山町402−1 京セラエルコ　株式会社","2011-05-02 09:37:02.000000"
"242-8610","神奈川県大和市都市計画事業渋谷（南部地区）土地区画整理事業地内74街区1外 イオンリテール　株式会社　イオン大和店","2011-05-02 09:37:02.000000"
"951-8555","新潟県新潟市中央区西船見町5932番地445 新潟市水族館　マリンピア日本海","2011-05-02 09:37:02.000000"
"939-8571","富山県富山市小中269 北陸電気工事　株式会社","2011-05-02 09:37:02.000000"
"939-8572","富山県富山市小中269 北陸電気工事　株式会社","2011-05-02 09:37:02.000000"
"919-2293","福井県大飯郡高浜町宮崎87−14−2 社会保険高浜病院","2011-05-02 09:37:02.000000"
"919-2294","福井県大飯郡高浜町宮崎87−14−2 高浜社会保険介護老人保健施設","2011-05-02 09:37:02.000000"
"392-8628","長野県諏訪市小和田南14−5（諏訪支店私書箱第6号） 株式会社　八十二銀行　諏訪支店","2011-05-02 09:37:02.000000"
"432-8580","静岡県浜松市中区富塚町328 財団法人　浜松市医療公社　浜松医療センター","2011-05-02 09:37:02.000000"
"462-8508","愛知県名古屋市北区平手町1丁目1番地の1 名古屋市立西部医療センター","2011-05-02 09:37:02.000000"
"514-2392","三重県津市安濃町草生360 独立行政法人　農業・食品産業技術総合研究機構　野菜茶業研究所","2011-05-02 09:37:02.000000"
"569-8503","大阪府高槻市桜町1−2 コニカミノルタ　高槻サイト","2011-05-02 09:37:02.000000"
"573-1030","大阪府枚方市中宮北町20番3号 枚方市上下水道局","2011-05-02 09:37:02.000000"
"640-8514","和歌山県和歌山市南汀丁18番地和歌山東急イン2階 和歌山県医師会","2011-05-02 09:37:02.000000"
"708-8517","岡山県津山市河辺字下閂1111−1 パナソニックエレクトロニックデバイスジャパン　株式会社　津山ディビジョン","2011-05-02 09:37:02.000000"
"719-3292","岡山県真庭市久世2927−2 真庭市役所","2011-05-02 09:37:02.000000"
"732-8504","広島県広島市東区二葉の里1−1−46 生活協同組合連合会　コープ中国四国事業連合","2011-05-02 09:37:02.000000"
"810-8561","福岡県福岡市中央区天神1−14−16 株式会社ＪＴＢ九州","2011-05-02 09:37:02.000000"
"810-8650","福岡県福岡市中央区地行浜2−2−3 ヒルトン福岡シーホーク","2011-05-02 09:37:02.000000"
"869-1192","熊本県菊池郡菊陽町大字久保田2800 菊陽町役場","2011-05-02 09:37:02.000000"
