"986-0033","宮城県石巻市美園","2014-02-04 00:41:02.000000"
"986-0867","宮城県石巻市わかば","2014-02-04 00:41:02.000000"
"015-0808","秋田県由利本荘市大門","2014-02-04 00:41:02.000000"
"015-0809","秋田県由利本荘市本荘","2014-02-04 00:41:02.000000"
"990-2317","山形県山形市みはらしの丘","2014-02-04 00:41:02.000000"
"999-3107","山形県上山市みはらしの丘","2014-02-04 00:41:02.000000"
"300-1161","茨城県稲敷郡阿見町よしわら","2014-02-04 00:41:02.000000"
"350-1138","埼玉県川越市中台元町","2014-02-04 00:41:02.000000"
"333-0811","埼玉県川口市戸塚","2014-02-04 00:41:02.000000"
"333-0817","埼玉県川口市戸塚南","2014-02-04 00:41:02.000000"
"945-0034","新潟県柏崎市三和町","2014-02-04 00:41:02.000000"
"518-1326","三重県伊賀市槙山","2014-02-04 00:41:02.000000"
"673-0870","兵庫県明石市朝霧南町","2014-02-04 00:41:02.000000"
"709-0515","岡山県和気郡和気町米澤","2014-02-04 00:41:02.000000"
"753-0221","山口県山口市大内矢田北","2014-02-04 00:41:02.000000"
"753-0222","山口県山口市大内矢田南","2014-02-04 00:41:02.000000"
"863-2201","熊本県天草市五和町御領","2014-02-04 00:41:02.000000"
"891-0117","鹿児島県鹿児島市西谷山","2014-02-04 00:41:02.000000"
"300-0388","茨城県稲敷郡阿見町大字吉原2700 あみプレミアム・アウトレット","2014-02-04 00:41:02.000000"
"327-8533","栃木県佐野市越名町2058 佐野プレミアム・アウトレット","2014-02-04 00:41:02.000000"
"100-8151","東京都千代田区大手町1丁目7−1読売新聞ビル 株式会社　読売巨人軍","2014-02-04 00:41:02.000000"
"102-8077","東京都千代田区五番町3−1五番町グランドビル 株式会社　ＫＡＤＯＫＡＷＡ　角川マガジンズブランドカンパニー","2014-02-04 00:41:02.000000"
"102-8005","東京都千代田区九段南4−8−28 日本大学　通信教育部","2014-02-04 00:41:02.000000"
"105-8430","東京都港区虎ノ門2−10−1 伊藤忠エネクス　株式会社","2014-02-04 00:41:02.000000"
"108-8405","東京都港区芝4−1−23三田ＮＮビル21階 サーモス　株式会社","2014-02-04 00:41:02.000000"
"112-8680","東京都文京区関口2丁目10−8 藤田観光　株式会社　ホテル椿山荘東京","2014-02-04 00:41:02.000000"
"110-8516","東京都台東区台東4丁目19−18 株式会社　日伝　東京支店","2014-02-04 00:41:02.000000"
"110-8685","東京都台東区入谷2−7−1 トクダマシモエース　株式会社","2014-02-04 00:41:02.000000"
"130-8545","東京都墨田区両国4丁目35−9 東京東信用金庫","2014-02-04 00:41:02.000000"
"144-8522","東京都大田区蒲田5丁目26−8 株式会社　加登屋","2014-02-04 00:41:02.000000"
"134-8576","東京都江戸川区臨海町3丁目6−3 バニーコルアート　株式会社","2014-02-04 00:41:02.000000"
"216-8631","神奈川県川崎市宮前区水沢2丁目17番1号 昌栄印刷　株式会社","2014-02-04 00:41:02.000000"
"389-0593","長野県東御市和8655 株式会社　アヅマ","2014-02-04 00:41:02.000000"
"389-0592","長野県東御市県281−2 東御市役所","2014-02-04 00:41:02.000000"
"389-0598","長野県東御市和8513−1 永井農場","2014-02-04 00:41:02.000000"
"509-5196","岐阜県土岐市土岐ヶ丘1−2 土岐プレミアム・アウトレット","2014-02-04 00:41:02.000000"
"417-8505","静岡県富士市西柏原新田201 パーパス　株式会社","2014-02-04 00:41:02.000000"
"460-8403","愛知県名古屋市中区栄1丁目10番5号 株式会社　御園座","2014-02-04 00:41:02.000000"
"441-0195","愛知県豊川市小坂井町道地100番地1 総合青山病院","2014-02-04 00:41:02.000000"
"516-8686","三重県伊勢市朝熊町3477−36 キクカワエンタープライズ　株式会社","2014-02-04 00:41:02.000000"
"553-8501","大阪府大阪市福島区大開1丁目8−1 大阪市福島区役所","2014-02-04 00:41:02.000000"
"544-8686","大阪府大阪市生野区桃谷1丁目3番23号 昌栄印刷　株式会社","2014-02-04 00:41:02.000000"
"530-8217","大阪府大阪市北区梅田3−1−3 ＪＲ西日本ＳＣ開発　株式会社（ＬＵＣＵＡ）","2014-02-04 00:41:02.000000"
"540-8581","大阪府大阪市中央区谷町2丁目9番3号ガレリア大手前ビル11Ｆ 日本直販　株式会社","2014-02-04 00:41:02.000000"
"651-2181","兵庫県神戸市西区曙町1070 総合リハビリテーションセンター","2014-02-04 00:41:02.000000"
"733-8616","広島県広島市西区商工センター1丁目1−46 丸井産業　株式会社","2014-02-04 00:41:02.000000"
"841-8504","佐賀県鳥栖市弥生が丘8−1 鳥栖プレミアム・アウトレット","2014-02-04 00:41:02.000000"
"870-8544","大分県大分市新川町2丁目5番17号 社会保険診療報酬支払基金　大分支部","2014-02-04 00:41:02.000000"
"874-8688","大分県別府市鶴見45番地の3 べっぷ日出農業協同組合","2014-02-04 00:41:02.000000"
