"501-6061","岐阜県羽島郡笠松町泉町","2016-05-02 09:27:12.000000"
"501-0425","岐阜県本巣郡北方町加茂","2016-05-02 09:27:12.000000"
"501-0425","岐阜県本巣郡北方町栄町","2016-05-02 09:27:12.000000"
"501-0425","岐阜県本巣郡北方町東加茂","2016-05-02 09:27:12.000000"
"501-0425","岐阜県本巣郡北方町若宮","2016-05-02 09:27:12.000000"
"620-0841","京都府福知山市駒場","2016-05-02 09:27:12.000000"
"883-0108","宮崎県日向市東郷町八重原迫野内","2016-05-02 09:27:12.000000"
"329-1195","栃木県宇都宮市白沢町500 河内地域自治センター","2016-05-02 09:27:12.000000"
"351-8510","埼玉県朝霞市岡2丁目11−10 東洋大学　朝霞校舎","2016-05-02 09:27:12.000000"
"100-6178","東京都千代田区永田町2丁目11−1山王パークタワー 消費者庁","2016-05-02 09:27:12.000000"
"101-8642","東京都千代田区外神田1−18−13秋葉原ダイビル ＹＫＫ　株式会社","2016-05-02 09:27:12.000000"
"102-8301","東京都千代田区九段北4丁目1−13ニュー原鉄ビル2Ｆ 株式会社　シティ出版","2016-05-02 09:27:12.000000"
"103-8313","東京都中央区日本橋富沢町2−6 小堺化学工業　株式会社","2016-05-02 09:27:12.000000"
"103-8339","東京都中央区日本橋室町4丁目3−18東京建物室町ビル 三省物産　株式会社","2016-05-02 09:27:12.000000"
"104-8320","東京都中央区京橋2丁目8−7 株式会社　中央公論社","2016-05-02 09:27:12.000000"
"104-8304","東京都中央区京橋2丁目6−21 株式会社　パイロットコーポレーション","2016-05-02 09:27:12.000000"
"105-8451","東京都港区虎ノ門1丁目3−1 森村商事　株式会社","2016-05-02 09:27:12.000000"
"160-8324","東京都新宿区西新宿6丁目24−1西新宿三井ビルディング24Ｆ エプソン販売　株式会社","2016-05-02 09:27:12.000000"
"169-8511","東京都新宿区百人町1丁目8−10 株式会社　コクド東京セールスセンター","2016-05-02 09:27:12.000000"
"169-8510","東京都新宿区百人町2丁目4−8ステアーズビル3Ｆ 株式会社　コスモリバティ社","2016-05-02 09:27:12.000000"
"169-8588","東京都新宿区北新宿4丁目8−16 株式会社　三栄書房","2016-05-02 09:27:12.000000"
"169-8530","東京都新宿区百人町2丁目25−13 株式会社　ニユートーキヨー","2016-05-02 09:27:12.000000"
"169-8551","東京都新宿区百人町2丁目4−5及川ビル4Ｆ 株式会社　博鳳堂","2016-05-02 09:27:12.000000"
"169-8666","東京都新宿区高田馬場4丁目9−12 株式会社　三菱電機ビジネスシステム","2016-05-02 09:27:12.000000"
"169-8515","東京都新宿区百人町2丁目2−33 株式会社　ロッテ　新宿工場","2016-05-02 09:27:12.000000"
"169-8645","東京都新宿区高田馬場4丁目3−7 コーエークレジット　株式会社　管理部","2016-05-02 09:27:12.000000"
"169-8640","東京都新宿区高田馬場4丁目4−5 コーエークレジット　株式会社","2016-05-02 09:27:12.000000"
"169-8624","東京都新宿区西早稲田3丁目30−16 財団法人　宇宙環境利用推進センター","2016-05-02 09:27:12.000000"
"169-8637","東京都新宿区高田馬場4丁目39−7 ゼンケン教育システム　株式会社","2016-05-02 09:27:12.000000"
"169-8560","東京都新宿区大久保1丁目11−3 大東　株式会社","2016-05-02 09:27:12.000000"
"169-8543","東京都新宿区大久保1丁目3−21 東京特殊電線　株式会社","2016-05-02 09:27:12.000000"
"169-8603","東京都新宿区西早稲田1丁目21−1早稲田大学西早稲田ビルディング 日本カードセンター　（株）","2016-05-02 09:27:12.000000"
"169-8533","東京都新宿区大久保1丁目16−15豊生堂ビル 豊生堂","2016-05-02 09:27:12.000000"
"169-8507","東京都新宿区百人町2丁目27−7 ホテル　海洋","2016-05-02 09:27:12.000000"
"140-8860","東京都品川区東品川3−32−42 京セラケミカル　株式会社","2016-05-02 09:27:12.000000"
"140-8830","東京都品川区東品川3−32−42 京セラサーキットソリューションズ　株式会社","2016-05-02 09:27:12.000000"
"140-8537","東京都品川区東大井5丁目23番37号 三菱鉛筆　株式会社","2016-05-02 09:27:12.000000"
"140-8621","東京都品川区東品川2丁目2−8 ネットワンシステムズ　株式会社","2016-05-02 09:27:12.000000"
"141-8613","東京都品川区大崎1丁目11番2号 株式会社　ローソンマート","2016-05-02 09:27:12.000000"
"141-8507","東京都品川区西五反田5丁目3−1 東京電力　品川支社","2016-05-02 09:27:12.000000"
"146-8610","東京都大田区池上5丁目12−17 東京電力　株式会社　品川支社　大田営業センター","2016-05-02 09:27:12.000000"
"150-8488","東京都渋谷区恵比寿1丁目28−1 あいおい損害保険　株式会社","2016-05-02 09:27:12.000000"
"167-8534","東京都杉並区南荻窪4丁目40−11 東京電力　株式会社　東京支店荻窪支社","2016-05-02 09:27:12.000000"
"116-8550","東京都荒川区東尾久5丁目31−11 東京電力　株式会社　東京工事センター","2016-05-02 09:27:12.000000"
"226-8501","神奈川県横浜市緑区長津田町4259 東京工業大学　生命理工学部","2016-05-02 09:27:12.000000"
"226-8503","神奈川県横浜市緑区長津田町4259 東京工業大学　その他","2016-05-02 09:27:12.000000"
"226-8502","神奈川県横浜市緑区長津田町4259 東京工業大学　大学院総合理工学研究科","2016-05-02 09:27:12.000000"
"920-2395","石川県白山市女原ト46番地 白山市　尾口市民サービスセンター","2016-05-02 09:27:12.000000"
"913-8533","福井県坂井市三国町池上80−1 武生三国モーターボート競走施行組合","2016-05-02 09:27:12.000000"
"381-2283","長野県長野市丹波島1丁目1−12 ミヤマ　株式会社","2016-05-02 09:27:12.000000"
"479-8501","愛知県常滑市新開町4丁目111 常滑市競艇事業部　（常滑競艇）","2016-05-02 09:27:12.000000"
"520-8515","滋賀県大津市梅林1丁目3−10 日本年金機構　滋賀事務センター","2016-05-02 09:27:12.000000"
"570-8507","大阪府守口市文園町10−15 関西医科大学附属病院","2016-05-02 09:27:12.000000"
"674-8686","兵庫県明石市魚住町清水1106−4（明石西郵便局私書箱第6号） 新キャタピラー三菱　株式会社　明石事業所","2016-05-02 09:27:12.000000"
"640-8550","和歌山県和歌山市梅原579−1 ＮＫワークス　株式会社","2016-05-02 09:27:12.000000"
"703-8522","岡山県岡山市中区古京町1丁目1番10−602号 社団法人　岡山県医師会","2016-05-02 09:27:12.000000"
"770-8503","徳島県徳島市蔵本町3丁目18−15 徳島大学分子酵素学研究センター","2016-05-02 09:27:12.000000"
"812-8620","福岡県福岡市博多区沖浜町12番1号 福岡市港湾局","2016-05-02 09:27:12.000000"
