"160-0002","東京都新宿区坂町","2015-08-03 09:59:39.000000"
"160-0002","東京都新宿区四谷坂町","2015-08-03 09:59:39.000000"
"444-0112","愛知県額田郡幸田町北鷲田","2015-08-03 09:59:39.000000"
"555-0031","大阪府大阪市西淀川区出来島","2015-08-03 09:59:39.000000"
"745-0856","山口県周南市浦山","2015-08-03 09:59:39.000000"
"745-0864","山口県周南市北山","2015-08-03 09:59:39.000000"
"745-0865","山口県周南市蓮ケ浴","2015-08-03 09:59:39.000000"
"795-0081","愛媛県大洲市菅田町菅田甲","2015-08-03 09:59:39.000000"
"024-0192","岩手県北上市北工業団地3−17 岩手スリーエム　株式会社","2015-08-03 09:59:39.000000"
"311-0193","茨城県那珂市向山801−1 独立行政法人　日本原子力研究開発機構　那珂核融合研究所","2015-08-03 09:59:39.000000"
"319-1194","茨城県那珂郡東海村大字村松4−33 独立行政法人　日本原子力研究開発機構　東海研究開発センター核燃料サイクル工学研究所","2015-08-03 09:59:39.000000"
"319-1195","茨城県那珂郡東海村大字白方白根2−4 独立行政法人　日本原子力研究開発機構　東海研究開発センター原子力科学研究所","2015-08-03 09:59:39.000000"
"371-8686","群馬県前橋市表町2丁目16−7（前橋中央郵便局私書箱第11号） 前橋　税務署","2015-08-03 09:59:39.000000"
"330-8686","埼玉県さいたま市大宮区土手町1丁目49−8Ｇ・Ｍ大宮ビル 全国健康保険協会　埼玉支部","2015-08-03 09:59:39.000000"
"273-8585","千葉県船橋市浜町2丁目1番1号 ららぽーとマネジメント　株式会社","2015-08-03 09:59:39.000000"
"271-8518","千葉県松戸市岩瀬473−2 千葉地方法務局　松戸支局","2015-08-03 09:59:39.000000"
"100-8173","東京都千代田区大手町2丁目6番3号 新日石不動産　株式会社","2015-08-03 09:59:39.000000"
"100-8162","東京都千代田区大手町2丁目6番3号 ＪＸ日鉱日石エネルギー　株式会社","2015-08-03 09:59:39.000000"
"100-8163","東京都千代田区大手町2丁目6番3号 ＪＸ日鉱日石開発　株式会社","2015-08-03 09:59:39.000000"
"100-8164","東京都千代田区大手町2丁目6番3号 ＪＸ日鉱日石金属　株式会社","2015-08-03 09:59:39.000000"
"100-8161","東京都千代田区大手町2丁目6番3号 ＪＸホールディングス　株式会社","2015-08-03 09:59:39.000000"
"100-8138","東京都千代田区大手町1丁目1−3大手センタービル2階 ＵＦＪつばさ証券　株式会社","2015-08-03 09:59:39.000000"
"102-8236","東京都千代田区五番町6番2号ホーマットホライゾンビル ライト工業　株式会社","2015-08-03 09:59:39.000000"
"104-8180","東京都中央区銀座8−13−1 リコージャパン　株式会社","2015-08-03 09:59:39.000000"
"108-8250","東京都港区港南2−18−1ＪＲ品川イーストビル 株式会社　日立ソリューションズ","2015-08-03 09:59:39.000000"
"160-8341","東京都新宿区新宿5−15−5新宿三光町ビル 株式会社　エアーリンク","2015-08-03 09:59:39.000000"
"160-8549","東京都新宿区坂町27−5 株式会社　公募ガイド社","2015-08-03 09:59:39.000000"
"160-8543","東京都新宿区坂町26番地 コモンズ　株式会社","2015-08-03 09:59:39.000000"
"140-8512","東京都品川区南大井6−23−1 株式会社　日立ソリューションズ","2015-08-03 09:59:39.000000"
"930-8630","富山県富山市総曲輪2丁目2−8（富山南郵便局富山駅前分室私書箱第30号） 株式会社　富山第一銀行　本店","2015-08-03 09:59:39.000000"
"914-8510","福井県敦賀市明神町3 独立行政法人　日本原子力研究開発機構　敦賀本部","2015-08-03 09:59:39.000000"
"914-8585","福井県敦賀市木崎65−20 独立行政法人　日本原子力研究開発機構　敦賀本部","2015-08-03 09:59:39.000000"
"401-0395","山梨県南都留郡富士河口湖町船津6663−2 河口湖精密　株式会社","2015-08-03 09:59:39.000000"
"399-8285","長野県安曇野市豊科田沢6925 三洋エプソンイメージングデバイス　株式会社","2015-08-03 09:59:39.000000"
"389-0295","長野県北佐久郡御代田町大字御代田4107番地5 シチズンファインテックミヨタ　株式会社","2015-08-03 09:59:39.000000"
"503-8510","岐阜県大垣市新田町2丁目1234丸順ＧＩＣビル 株式会社　丸順","2015-08-03 09:59:39.000000"
"421-0397","静岡県榛原郡吉田町大幡1300−2 （株）　ソニー・ファミリークラブ","2015-08-03 09:59:39.000000"
"421-0394","静岡県榛原郡吉田町大幡1300−2 株式会社　ソニー・ファミリークラブ","2015-08-03 09:59:39.000000"
"421-0393","静岡県榛原郡吉田町大幡1300−2 株式会社　ソニー・ファミリークラブ","2015-08-03 09:59:39.000000"
"421-0392","静岡県榛原郡吉田町大幡1300−2 株式会社　ソニー・ファミリークラブ","2015-08-03 09:59:39.000000"
"600-8688","京都府京都市下京区四条通烏丸東入長刀鉾町20番地 宝酒造　株式会社","2015-08-03 09:59:39.000000"
"553-8588","大阪府大阪市福島区福島4−8−5 株式会社　イリオス","2015-08-03 09:59:39.000000"
"536-8588","大阪府大阪市城東区森之宮1丁目6−107 財団法人　大阪がん予防検診センター","2015-08-03 09:59:39.000000"
"708-0698","岡山県苫田郡鏡野町上齋原1550 独立行政法人　日本原子力研究開発機構　人形峠環境技術センター","2015-08-03 09:59:39.000000"
"761-8577","香川県高松市多賀町2丁目10−20 株式会社　セシール","2015-08-03 09:59:39.000000"
"840-8571","佐賀県佐賀市水ヶ江1丁目12−9 佐賀県立病院好生館","2015-08-03 09:59:39.000000"
"894-8585","鹿児島県奄美市名瀬末広町12−1 株式会社　楠田書店","2015-08-03 09:59:39.000000"
